{
  "tool_slug": "cursor",
  "current_date": "2026-06-29",
  "update_reason": "Refresh pricing, model access, best plan, and source dates.",
  "official_url": "https://www.cursor.com/",
  "pricing_url": "https://www.cursor.com/pricing",
  "docs_url": "https://docs.cursor.com/",
  "scope": "single-tool"
}
